{
  "schemaVersion": 2,
  "releaseId": "managed-v2026.08.25.3",
  "promotionEligible": true,
  "artifactType": "ensou-dsh-enterprise-managed-source-runtime",
  "sourceBuilt": true,
  "platform": "win32-x64",
  "sourceIdentity": "github-https-tag-plus-ensou-managed-patch",
  "sourceRepository": "https://github.com/deepseek-ai/deepseek-harness.git",
  "sourceTag": "dsh-v0.1.2-rc.1",
  "sourceCommit": "a66e4702047846cdaa10c66c9d3df3951f5ea70d",
  "sourceTree": "27ab636bb3d77e698f5637e518db44ae1f61e262",
  "dshVersion": "0.1.2-rc.1",
  "baseLockfileSha256": "e12083149a77f790d39b64d018b6b8745c6a7aa95777ecb73e0a2f5ed5fdd0d9",
  "lockfileSha256": "0cc4aba6915e0221cf65f806c5ab932849137d5aa4f8f8d129afd6501b8bef7f",
  "runtimeWebAuthProtocol": "browser-launch-cookie-v1",
  "managedPatch": {
    "id": "dsh-v0.1.2-rc.1-enterprise-managed-v1",
    "manifestSchema": "ensou.dsh.upstream-patch-manifest.v3",
    "manifestSha256": "6e420ee233436fe5ce4974d630142320ca039297ccc9c3261a87e512332994e5",
    "patchSha256": "c5945fb046e4cb3d7897c99dc9f68404bcd5ab3352a322ce9063ae4d00723518",
    "patchBytes": 252249,
    "changedFileCount": 43,
    "modifiedPreimageCount": 35
  },
  "managedPolicy": {
    "signal": "DSH_ENTERPRISE_MANAGED_BOOT=ensou-dsh-launcher/v1",
    "profile": "enterprise-managed",
    "webArguments": "--host 127.0.0.1 --port <canonical 1..65535>",
    "model": "deepseek-v4-flash",
    "maxTokens": 8192,
    "gatewayAllowedModel": "deepseek-v4-flash",
    "gatewayMaxTokens": 8192,
    "managedSkillsRootEnvironment": "ENSOU_DSH_ENTERPRISE_SKILLS_ROOT",
    "sandboxMode": "workspace-write",
    "sandboxMaximumMode": "workspace-write",
    "approvalPolicy": "ask",
    "permissionPresets": ["workspace-write"],
    "workspaceRootSource": "process.cwd()",
    "restoredSessionCwdPolicy": "must-equal-workspace-root",
    "hostCompositionCanonicalSha256": "fff23b1e6602c2125408f4ce609662d301c5a3633ef5acaf9a14edfa918a6efb",
    "presetCompositionCanonicalSha256": "22044243781ab948f0c649843181835ab2b0b676246583ef675db4ad0f51b3b9",
    "presetMetadataCanonicalSha256": "4cb4661afe8d79f3687d1c58b401a2c072131dfd83a4c7389cec9e948f3d5eea",
    "loaderRootCanonicalSha256": "4f53cda18c2baa0c0354bb5f9a3ecbe5ed12ab4d8e11ba873c2f11161202b945",
    "pluginResolutionPolicy": "frozen exact installation map from managed base/web bundles; no ambient fallback"
  },
  "builtAtUtc": "2026-08-25T08:22:58.7633725+00:00",
  "toolchain": {
    "nodeVersion": "24.19.0",
    "nodeSha256": "bbbbbbbbbbbbbbbbbbbbbbbbbbbbbbbbbbbbbbbbbbbbbbbbbbbbbbbbbbbbbbbb",
    "pnpmVersion": "11.7.0",
    "npmVersion": "11.9.0"
  },
  "verification": {
    "cleanCheckout": true,
    "tagCommitMatch": true,
    "remoteTagCommitMatch": true,
    "tagSignatureVerified": false,
    "officialCheckoutUnchanged": true,
    "patchManifestValidated": true,
    "patchPreimagesVerified": true,
    "patchApplyCheck": true,
    "patchPostimagesVerified": true,
    "frozenLockfileInstall": true,
    "managedFocusedTests": true,
    "managedWindowsExcludedFocusedTests": true,
    "managedChangedPackageTypeBuild": true,
    "managedCliBundle": true,
    "managedSourceGates": true,
    "sourceBuild": "pnpm run build (reviewed managed patch applied)",
    "builtPackageInvariants": true,
    "deploymentMode": "pnpm-dedicated-lockfile-offline-deploy",
    "runtimeClosureAgainstPinnedSourceAndLock": true,
    "runtimeClosurePackageCount": 459,
    "portableCommandShimGate": true,
    "symlinkFreeRuntime": true,
    "bundledNodeVersionSmoke": true,
    "nativeModuleSmoke": ["node-pty", "koffi"],
    "webProfileDumpSmoke": true,
    "webHttpSmoke": true,
    "managedExactEnvironmentSmoke": true,
    "managedWorkspaceCwdSmoke": true,
    "managedRefusalSmoke": true,
    "extractedArtifactHashManifestVerified": true,
    "extractedArtifactSmoke": true,
    "buildToolingExcluded": true,
    "webSmokeUrl": "http://127.0.0.1:<ephemeral-port>/",
    "externalNetworkIsolation": false
  },
  "artifact": {
    "fileName": "EnsouDshRuntime-managed-v2026.08.25.3-win-x64.zip",
    "sizeBytes": 99871003,
    "sha256": "ebb4f366dc007da78a1d9168324afd2c0bd4a4da7fcd46e3d0f7d3cb13e22a73"
  },
  "licensing": {
    "harnessLicense": "MIT",
    "noticesIncluded": true,
    "organizationReviewRequired": true
  }
}
